{
  "schema_version": "1.0",
  "task_id": "T095-uniform-boundary-constant",
  "run_id": "iteration6-route-frame-cyclic-arc",
  "worker": "researcher",
  "status": "partial",
  "summary": "The generic half-memory frame inequality remains open. The route exactly freezes the dual tail under a cycle-plus-cut representation, reduces the covariance question to a nested cyclic-arc inequality S<=C_tail P, proves a conditional Pythagorean dual hierarchy and a frozen operator-valued random-rank Gram identity, closes signed equicorrelation and generic complement size at most two, and analytically refutes pathwise, reversal-paired, and remaining-frame inverse-Bellman closures.",
  "claims": [
    {
      "claim_id": "I6-A-GENERIC-TARGET",
      "statement": "For every unit-diagonal SPD A and q=ceil(n/2), the half-memory dual state satisfies P Q^{-1} P >= c mu A^{-1} for a universal c>0.",
      "status": "open_conjecture",
      "evidence_level": "E1",
      "assumptions": ["A is unit-diagonal SPD", "mu=lambda_min(A)", "q=ceil(n/2)"],
      "supporting_artifacts": ["research/iteration6/route_frame/FINAL_REPORT.md"],
      "open_objections": ["No generic dimension-free arc-tail covariance bound is known", "No generic local-frame preconditioner lower bound is supplied by this route"]
    },
    {
      "claim_id": "I6-A-CONDITIONAL-HIERARCHY",
      "statement": "Conditional dual regression certificates are monotone under refinement, with the exact Pythagorean gain C_H-C_G=E[(W_H-W_G)^T Q_H(W_H-W_G)].",
      "status": "proof_candidate",
      "evidence_level": "E3",
      "assumptions": ["Conditional second moments exist", "The conditional Q matrices are invertible; singular cases are interpreted by continuity on their support", "G is coarser than H"],
      "supporting_artifacts": ["research/iteration6/route_frame/conditional_dual_martingale_hierarchy.md", "research/iteration6/route_frame/evidence/conditional_dual_hierarchy.json"],
      "open_objections": ["No independent hostile audit has yet reconstructed the general identity"]
    },
    {
      "claim_id": "I6-A-RANDOM-RANK-GRAM",
      "statement": "For frozen coefficients and independent uniform row/column ranks, lower-inclusive and strict-upper masks satisfy E[G W G^T]=E[H W H^T]+C W C^T/m for every fixed symmetric W.",
      "status": "proof_candidate",
      "evidence_level": "E3",
      "assumptions": ["C and W are fixed before the random ranks", "W is symmetric", "Row and column rankings are independent and uniform"],
      "supporting_artifacts": ["research/iteration6/route_frame/conditional_random_rank_gram.md", "research/iteration6/route_frame/evidence/random_rank_gram.json"],
      "open_objections": ["Actual RPCD local-solve rows are adapted and do not satisfy the frozen-coefficient hypothesis"]
    },
    {
      "claim_id": "I6-A-CYCLIC-FREEZING",
      "statement": "Conditional on a directed cycle, the half-memory defect and the entire dual tail F^T D are fixed cyclic local rows multiplied by cut-arc masks; their cut covariance is the exact nested Hardy form (C6).",
      "status": "proof_candidate",
      "evidence_level": "E3",
      "assumptions": ["q=ceil(n/2)", "The linear order is generated by a directed cycle and a uniform cut"],
      "supporting_artifacts": ["research/iteration6/route_frame/cyclic_cut_freezing.md", "research/iteration6/route_frame/evidence/cyclic_cut_freezing.json"],
      "open_objections": ["No independent hostile audit has yet reconstructed the all-dimensional proof"]
    },
    {
      "claim_id": "I6-A-ARC-TARGET",
      "statement": "The generic covariance comparison follows from the concrete arc-tail inequality S<=C_tail P; scalar Hardy summation alone necessarily loses Theta(n).",
      "status": "idea",
      "evidence_level": "E2",
      "assumptions": ["Definitions P,Q,S use the q=ceil(n/2) local inverse", "A separate lower bound P>=c_P mu A^{-1} is available for transfer to the final target"],
      "supporting_artifacts": ["research/iteration6/route_frame/arc_tail_covariance_target.md", "research/iteration6/route_frame/cyclic_cut_freezing.md"],
      "open_objections": ["The dimension-free inequality S<=C_tail P is open", "The adapted signed off-diagonal row covariance is uncontrolled"]
    },
    {
      "claim_id": "I6-A-SMALL-COMPLEMENT",
      "statement": "The generic arc-tail comparison holds with C_tail=1/2 for n=4,5 and with C_tail<7/4 for n=6,7.",
      "status": "proof_candidate",
      "evidence_level": "E3",
      "assumptions": ["A is unit-diagonal SPD", "q=ceil(n/2)", "mu=lambda_min(A)"],
      "supporting_artifacts": ["research/iteration6/route_frame/arc_tail_covariance_target.md", "research/iteration6/route_frame/evidence/small_complement_arc_tail.json"],
      "open_objections": ["The analytic proof has not yet received an independent hostile audit", "The exact verifier samples n<=6; n=7 follows from the same m=2 symbolic argument"]
    },
    {
      "claim_id": "I6-A-SIGNED-EQUICORRELATION",
      "statement": "The arc-tail route gives S<=e^{-2}P for positive equicorrelation and, for every negative equicorrelation, S<=3P and P Q^{-1} P >= (mu/30)A^{-1}; diagonal-sign conjugates inherit the bounds.",
      "status": "proof_candidate",
      "evidence_level": "E3",
      "assumptions": ["A=(1-rho)I+rho J is SPD", "q=ceil(n/2)", "For the negative case -1/(n-1)<rho<0"],
      "supporting_artifacts": ["research/iteration6/route_frame/arc_tail_covariance_target.md", "research/iteration6/route_frame/evidence/equicorrelation_arc_tail.json"],
      "open_objections": ["The new negative-family proof has not yet received an independent hostile audit", "This structured family does not cover generic SPD matrices"]
    },
    {
      "claim_id": "I6-A-IDENTITY-JET",
      "statement": "For A=I+epsilon H, the leading half-memory tail covariance is epsilon^2[p2 H^2+(p1-p2)Diag(diag H^2)] and is below epsilon^2 I/8 when ||H||<=1.",
      "status": "proof_candidate",
      "evidence_level": "E3",
      "assumptions": ["H is symmetric with zero diagonal", "The remainder is interpreted at fixed n and fixed H"],
      "supporting_artifacts": ["research/iteration6/route_frame/near_identity_tail_jet.md", "research/iteration6/route_frame/evidence/near_identity_tail_jet.json"],
      "open_objections": ["The O(epsilon^3) remainder is not uniform in dimension", "No independent hostile audit has yet reconstructed the coefficient formula"]
    },
    {
      "claim_id": "I6-A-PATHWISE-BARRIER",
      "statement": "No dimension-free pathwise comparison Q_pi<=Gamma R_pi can hold for the half-memory state, even when mu is uniformly bounded below.",
      "status": "refuted",
      "evidence_level": "E3",
      "assumptions": ["The proposed Gamma is independent of dimension"],
      "supporting_artifacts": ["research/iteration6/route_frame/pathwise_triangular_projection_barrier.md", "research/iteration6/route_frame/evidence/pathwise_triangular_barrier.json"],
      "open_objections": ["This counterexample concerns one exponentially rare order and does not refute full averaging"]
    },
    {
      "claim_id": "I6-A-REVERSAL-BARRIER",
      "statement": "Pairing an order only with its full reversal does not yield a dimension-free covariance/frame comparison, even with a factor 1/mu.",
      "status": "refuted",
      "evidence_level": "E3",
      "assumptions": ["The comparison constant is dimension-free"],
      "supporting_artifacts": ["research/iteration6/route_frame/reverse_pair_triangular_barrier.md", "research/iteration6/route_frame/evidence/reverse_pair_barrier.json"],
      "open_objections": ["This does not refute averaging over all internal ranks"]
    },
    {
      "claim_id": "I6-A-RFI-BELLMAN",
      "statement": "The proposed remaining-frame inverse Bellman inequality is false even for the structured RPCD covariance lift.",
      "status": "refuted",
      "evidence_level": "E3",
      "assumptions": ["n=9", "A=(I+J)/2", "The lift acts on Sym(span(v_i)) with v_i=(e_0+e_i)/sqrt(2)"],
      "supporting_artifacts": ["research/iteration6/route_frame/special_lift_bellman_counterexample.md", "research/iteration6/route_frame/evidence/special_lift_bellman_counterexample.json"],
      "open_objections": []
    }
  ],
  "artifacts": [
    {"path": "research/iteration6/route_frame/FINAL_REPORT.md", "kind": "handoff", "description": "Portable synthesis with scope, exact claims, failures, reproduction commands, and next target."},
    {"path": "research/iteration6/route_frame/TIMING.json", "kind": "data", "description": "Observed start, required threshold, finalization time, and elapsed interval."},
    {"path": "research/iteration6/route_frame/conditional_dual_martingale_hierarchy.md", "kind": "proof", "description": "Conditional regression hierarchy and exact Pythagorean refinement identity."},
    {"path": "research/iteration6/route_frame/conditional_random_rank_gram.md", "kind": "proof", "description": "Frozen operator-valued random-rank cancellation and exact adaptation barrier."},
    {"path": "research/iteration6/route_frame/cyclic_cut_freezing.md", "kind": "proof", "description": "Cycle-plus-cut freezing of the full dual tail and nested arc covariance."},
    {"path": "research/iteration6/route_frame/arc_tail_covariance_target.md", "kind": "proof", "description": "Minimal generic arc inequality, low-complement closure, diagonal/cross decomposition, and signed-equicorrelation slices."},
    {"path": "research/iteration6/route_frame/nilpotent_half_memory_variational.md", "kind": "proof", "description": "Square-zero half-memory identities and tangent/Schur reduction."},
    {"path": "research/iteration6/route_frame/near_identity_tail_jet.md", "kind": "proof", "description": "All-dimensional second-order tail coefficient and nonuniform remainder boundary."},